{
  "$schema": "../../../../../app/schemas/profile-library.schema.json",
  "schema": "steel-profile-library",
  "schemaVersion": "0.2.0",
  "library": {
    "id": "starter-profile-library",
    "name": "Starter Demo Profile Library",
    "version": "0.2.0",
    "status": "demo-not-certified-for-fabrication",
    "description": "Point-based profile library for early viewer and editor development. Replace with verified standard catalog data before fabrication use."
  },
  "units": {
    "length": "mm",
    "angle": "deg",
    "area": "mm2",
    "massPerLength": "kg/m"
  },
  "sectionCoordinateSystem": {
    "memberAxis": "local-x-from-start-to-end",
    "pointFormat": "[y, z]",
    "sectionWidthAxis": "local-y",
    "sectionDepthAxis": "local-z",
    "positiveRotation": "right-hand-about-local-x",
    "contourRule": "each contour is closed by connecting the last point back to the first point",
    "solidContourOrientation": "counter-clockwise",
    "voidContourOrientation": "clockwise"
  },
  "profiles": {
    "DEMO_I_200X100X8X12": {
      "id": "DEMO_I_200X100X8X12",
      "designation": "Demo I 200x100x8x12",
      "profileType": "i-section",
      "section": {
        "type": "polygonal-section",
        "origin": "centroid",
        "contours": [
          {
            "id": "outer",
            "role": "solid",
            "points": [
              [
                -50,
                -100
              ],
              [
                50,
                -100
              ],
              [
                50,
                -88
              ],
              [
                4,
                -88
              ],
              [
                4,
                88
              ],
              [
                50,
                88
              ],
              [
                50,
                100
              ],
              [
                -50,
                100
              ],
              [
                -50,
                88
              ],
              [
                -4,
                88
              ],
              [
                -4,
                -88
              ],
              [
                -50,
                -88
              ]
            ]
          }
        ],
        "referencePoints": {
          "top-left": [
            -50,
            100
          ],
          "top-center": [
            0,
            100
          ],
          "top-right": [
            50,
            100
          ],
          "middle-left": [
            -50,
            0
          ],
          "middle-center": [
            0,
            0
          ],
          "middle-right": [
            50,
            0
          ],
          "bottom-left": [
            -50,
            -100
          ],
          "bottom-center": [
            0,
            -100
          ],
          "bottom-right": [
            50,
            -100
          ]
        },
        "semanticRefs": {
          "regions": [
            "top-flange",
            "bottom-flange",
            "web"
          ],
          "faces": [
            "top-flange.top",
            "top-flange.bottom-left",
            "top-flange.bottom-right",
            "bottom-flange.top-left",
            "bottom-flange.top-right",
            "bottom-flange.bottom",
            "web.left",
            "web.right"
          ],
          "edges": [
            "top-flange.outer-left",
            "top-flange.outer-right",
            "top-flange.inner-left",
            "top-flange.inner-right",
            "bottom-flange.outer-left",
            "bottom-flange.outer-right",
            "bottom-flange.inner-left",
            "bottom-flange.inner-right",
            "web.left",
            "web.right"
          ]
        }
      },
      "properties": {
        "area": 3808,
        "massPerLength": 29.89
      }
    },
    "DEMO_I_300X150X8X12": {
      "id": "DEMO_I_300X150X8X12",
      "designation": "Demo I 300x150x8x12",
      "profileType": "i-section",
      "section": {
        "type": "polygonal-section",
        "origin": "centroid",
        "contours": [
          {
            "id": "outer",
            "role": "solid",
            "points": [
              [
                -75,
                -150
              ],
              [
                75,
                -150
              ],
              [
                75,
                -138
              ],
              [
                4,
                -138
              ],
              [
                4,
                138
              ],
              [
                75,
                138
              ],
              [
                75,
                150
              ],
              [
                -75,
                150
              ],
              [
                -75,
                138
              ],
              [
                -4,
                138
              ],
              [
                -4,
                -138
              ],
              [
                -75,
                -138
              ]
            ]
          }
        ],
        "referencePoints": {
          "top-left": [
            -75,
            150
          ],
          "top-center": [
            0,
            150
          ],
          "top-right": [
            75,
            150
          ],
          "middle-left": [
            -75,
            0
          ],
          "middle-center": [
            0,
            0
          ],
          "middle-right": [
            75,
            0
          ],
          "bottom-left": [
            -75,
            -150
          ],
          "bottom-center": [
            0,
            -150
          ],
          "bottom-right": [
            75,
            -150
          ]
        },
        "semanticRefs": {
          "regions": [
            "top-flange",
            "bottom-flange",
            "web"
          ],
          "faces": [
            "top-flange.top",
            "top-flange.bottom-left",
            "top-flange.bottom-right",
            "bottom-flange.top-left",
            "bottom-flange.top-right",
            "bottom-flange.bottom",
            "web.left",
            "web.right"
          ],
          "edges": [
            "top-flange.outer-left",
            "top-flange.outer-right",
            "top-flange.inner-left",
            "top-flange.inner-right",
            "bottom-flange.outer-left",
            "bottom-flange.outer-right",
            "bottom-flange.inner-left",
            "bottom-flange.inner-right",
            "web.left",
            "web.right"
          ]
        }
      },
      "properties": {
        "area": 5808,
        "massPerLength": 45.59
      }
    },
    "DEMO_RHS_100X50X5": {
      "id": "DEMO_RHS_100X50X5",
      "designation": "Demo RHS 100x50x5",
      "profileType": "rhs",
      "section": {
        "type": "polygonal-section",
        "origin": "centroid",
        "contours": [
          {
            "id": "outer",
            "role": "solid",
            "points": [
              [
                -25,
                -50
              ],
              [
                25,
                -50
              ],
              [
                25,
                50
              ],
              [
                -25,
                50
              ]
            ]
          },
          {
            "id": "inner",
            "role": "void",
            "points": [
              [
                -20,
                -45
              ],
              [
                -20,
                45
              ],
              [
                20,
                45
              ],
              [
                20,
                -45
              ]
            ]
          }
        ],
        "referencePoints": {
          "top-left": [
            -25,
            50
          ],
          "top-center": [
            0,
            50
          ],
          "top-right": [
            25,
            50
          ],
          "middle-left": [
            -25,
            0
          ],
          "middle-center": [
            0,
            0
          ],
          "middle-right": [
            25,
            0
          ],
          "bottom-left": [
            -25,
            -50
          ],
          "bottom-center": [
            0,
            -50
          ],
          "bottom-right": [
            25,
            -50
          ]
        },
        "semanticRefs": {
          "regions": [
            "outer-wall",
            "inner-void"
          ],
          "faces": [
            "outer.top",
            "outer.bottom",
            "outer.left",
            "outer.right",
            "inner.top",
            "inner.bottom",
            "inner.left",
            "inner.right"
          ],
          "edges": [
            "outer.top-left",
            "outer.top-right",
            "outer.bottom-left",
            "outer.bottom-right",
            "inner.top-left",
            "inner.top-right",
            "inner.bottom-left",
            "inner.bottom-right"
          ]
        }
      },
      "properties": {
        "area": 1400,
        "massPerLength": 10.99
      }
    },
    "DEMO_SHS_100X100X5": {
      "id": "DEMO_SHS_100X100X5",
      "designation": "Demo SHS 100x100x5",
      "profileType": "shs",
      "section": {
        "type": "polygonal-section",
        "origin": "centroid",
        "contours": [
          {
            "id": "outer",
            "role": "solid",
            "points": [
              [
                -50,
                -50
              ],
              [
                50,
                -50
              ],
              [
                50,
                50
              ],
              [
                -50,
                50
              ]
            ]
          },
          {
            "id": "inner",
            "role": "void",